{
  "version": "1.0.0",
  "status": "DISCOVERED",
  "source": "TypeScript AST of workers/W01-payload/src/payload.config.ts + statically imported collection configs",
  "generatedBy": "scripts/payload-native-inventory.mjs",
  "collections": [
    {
      "slug": "users",
      "sourceRef": "workers/W01-payload/src/collections/Users.ts:Users",
      "auth": true,
      "fields": [
        {
          "name": "identityId",
          "type": "text",
          "sourceRef": "workers/W01-payload/src/collections/Users.ts:field:identityId",
          "classification": "PAYLOAD_CONFIG_DISCOVERED",
          "required": false,
          "unique": true
        },
        {
          "name": "username",
          "type": "text",
          "sourceRef": "workers/W01-payload/src/collections/Users.ts:field:username",
          "classification": "PAYLOAD_CONFIG_DISCOVERED",
          "required": true,
          "unique": true
        },
        {
          "name": "displayName",
          "type": "text",
          "sourceRef": "workers/W01-payload/src/collections/Users.ts:field:displayName",
          "classification": "PAYLOAD_CONFIG_DISCOVERED"
        },
        {
          "name": "bio",
          "type": "textarea",
          "sourceRef": "workers/W01-payload/src/collections/Users.ts:field:bio",
          "classification": "PAYLOAD_CONFIG_DISCOVERED"
        },
        {
          "name": "avatar",
          "type": "text",
          "sourceRef": "workers/W01-payload/src/collections/Users.ts:field:avatar",
          "classification": "PAYLOAD_CONFIG_DISCOVERED"
        },
        {
          "name": "locale",
          "type": "text",
          "sourceRef": "workers/W01-payload/src/collections/Users.ts:field:locale",
          "classification": "PAYLOAD_CONFIG_DISCOVERED",
          "defaultValue": "en-US"
        },
        {
          "name": "timezone",
          "type": "text",
          "sourceRef": "workers/W01-payload/src/collections/Users.ts:field:timezone",
          "classification": "PAYLOAD_CONFIG_DISCOVERED",
          "defaultValue": "UTC"
        }
      ]
    },
    {
      "slug": "media",
      "sourceRef": "workers/W01-payload/src/collections/Media.ts:Media",
      "auth": false,
      "fields": [
        {
          "name": "alt",
          "type": "text",
          "sourceRef": "workers/W01-payload/src/collections/Media.ts:field:alt",
          "classification": "PAYLOAD_CONFIG_DISCOVERED",
          "required": true
        },
        {
          "name": "ownerUserId",
          "type": "text",
          "sourceRef": "workers/W01-payload/src/collections/Media.ts:field:ownerUserId",
          "classification": "PAYLOAD_CONFIG_DISCOVERED"
        },
        {
          "name": "uploadIdempotencyKey",
          "type": "text",
          "sourceRef": "workers/W01-payload/src/collections/Media.ts:field:uploadIdempotencyKey",
          "classification": "PAYLOAD_CONFIG_DISCOVERED",
          "unique": true
        },
        {
          "name": "uploadFingerprint",
          "type": "text",
          "sourceRef": "workers/W01-payload/src/collections/Media.ts:field:uploadFingerprint",
          "classification": "PAYLOAD_CONFIG_DISCOVERED"
        }
      ]
    }
  ]
}
